{
  "id": "fortune-tellers-robes",
  "name": "Fortune-Teller's Robes",
  "source": "Circus System",
  "flavor": "Layered silks and star-charts — the working clothes of the tent mystics. No protection to speak of, but they need no training to wear, which is the whole point for someone whose defense is their mind, not their hide.",
  "category": "clothing",
  "baseAC": 10,
  "maxDexBonus": null,
  "availability": "starter",
  "stealthDisadvantage": false
}
