{
  "id": "gladiators-half-plate",
  "name": "Gladiator's Half-Plate",
  "source": "Circus System",
  "flavor": "Arena kit, polished for the crowd and shaped for the kill — breastplate, pauldrons, and nothing below the hip to slow the footwork.",
  "category": "medium",
  "baseAC": 15,
  "maxDexBonus": 2,
  "availability": "bought",
  "stealthDisadvantage": true
}
